{
  "$id": "https://local.codex/post-office-next/contracts/v1/operations/task.create.result.schema.json",
  "$schema": "http://json-schema.org/draft-07/schema#",
  "additionalProperties": false,
  "examples": [
    {
      "afterRoot": "sha256:1111111111111111111111111111111111111111111111111111111111111111",
      "aggregateVersion": 0,
      "beforeRoot": "sha256:1111111111111111111111111111111111111111111111111111111111111111",
      "createdIds": [],
      "eventId": "PON-EVENT-001",
      "ok": true,
      "operation": "task.create",
      "receipt": {
        "mutationEventId": "PON-EVENT-001",
        "receiptId": "PON-RECEIPT-001",
        "recordedAt": "2026-09-04T12:00:00Z",
        "requestSha256": "sha256:2222222222222222222222222222222222222222222222222222222222222222",
        "stateRoot": "sha256:1111111111111111111111111111111111111111111111111111111111111111"
      },
      "requestId": "PON-REQUEST-001",
      "schemaVersion": "1",
      "task": {
        "acceptanceContractRoot": "sha256:5555555555555555555555555555555555555555555555555555555555555555",
        "authorityGrantId": "PON-GRANT-001",
        "endpointBinding": null,
        "id": "PON-TASK-001",
        "mutablePackageId": null,
        "objective": "Example objective",
        "projectId": "PON-PROJECT-001",
        "state": "ACTIVE",
        "taskKind": "PROJECT_MANAGEMENT"
      },
      "warnings": []
    },
    {
      "diagnostic": {
        "code": "PON_INPUT_INVALID",
        "details": {},
        "message": "Example failure",
        "retryable": false,
        "schemaVersion": "1",
        "severity": "ERROR"
      },
      "ok": false,
      "operation": "task.create",
      "requestId": "PON-REQUEST-001",
      "schemaVersion": "1"
    }
  ],
  "oneOf": [
    {
      "additionalProperties": true,
      "properties": {
        "aggregateVersion": {
          "minimum": 0,
          "type": "integer"
        },
        "eventId": {
          "minLength": 1,
          "pattern": "^[A-Za-z][A-Za-z0-9._:-]{2,127}$",
          "type": "string"
        },
        "ok": {
          "const": true
        }
      },
      "required": [
        "ok",
        "beforeRoot",
        "afterRoot",
        "createdIds",
        "warnings",
        "receipt",
        "task",
        "eventId",
        "aggregateVersion"
      ],
      "type": "object"
    },
    {
      "additionalProperties": true,
      "not": {
        "anyOf": [
          {
            "required": [
              "eventId"
            ]
          },
          {
            "required": [
              "beforeRoot"
            ]
          },
          {
            "required": [
              "afterRoot"
            ]
          },
          {
            "required": [
              "aggregateVersion"
            ]
          },
          {
            "required": [
              "createdIds"
            ]
          },
          {
            "required": [
              "receipt"
            ]
          }
        ]
      },
      "properties": {
        "diagnostic": {
          "additionalProperties": false,
          "properties": {
            "code": {
              "enum": [
                "PON_AUTHENTICATION_FAILED",
                "PON_AUTHORIZATION_DENIED",
                "PON_CONCURRENCY_CONFLICT",
                "PON_CONTRACT_FIXTURE_UNEXPECTED",
                "PON_CONTRACT_INVALID",
                "PON_CREDENTIAL_INVALID",
                "PON_CUSTODY_NOT_VERIFIED",
                "PON_DATABASE_INVALID",
                "PON_IDEMPOTENCY_CONFLICT",
                "PON_INPUT_INVALID",
                "PON_INTERNAL_ERROR",
                "PON_KERNEL_ALREADY_BOOTSTRAPPED",
                "PON_KERNEL_NOT_BOOTSTRAPPED",
                "PON_LEGACY_SCHEMA_UNSUPPORTED",
                "PON_MIGRATION_MISMATCH",
                "PON_OBSERVATION_MISMATCH",
                "PON_OPERATION_NOT_IMPLEMENTED",
                "PON_OUTPUT_EXISTS",
                "PON_PATH_CONFLICT",
                "PON_PATH_NOT_FOUND",
                "PON_PRODUCTION_MUTATION_FORBIDDEN",
                "PON_RATE_LIMITED",
                "PON_RECONCILIATION_AMBIGUOUS",
                "PON_RECONCILIATION_DUPLICATE",
                "PON_RECONCILIATION_HASH_MISMATCH",
                "PON_RECONCILIATION_ORPHAN",
                "PON_SNAPSHOT_INTEGRITY_FAILURE",
                "PON_SNAPSHOT_SOURCE_CHANGED"
              ],
              "minLength": 1,
              "type": "string"
            },
            "details": {
              "type": "object"
            },
            "message": {
              "minLength": 1,
              "type": "string"
            },
            "retryable": {
              "type": "boolean"
            },
            "schemaVersion": {
              "const": "1"
            },
            "severity": {
              "enum": [
                "INFO",
                "WARNING",
                "ERROR",
                "CRITICAL"
              ],
              "minLength": 1,
              "type": "string"
            }
          },
          "required": [
            "schemaVersion",
            "code",
            "message",
            "severity",
            "retryable",
            "details"
          ],
          "type": "object"
        },
        "ok": {
          "const": false
        }
      },
      "required": [
        "ok",
        "diagnostic"
      ],
      "type": "object"
    }
  ],
  "properties": {
    "afterRoot": {
      "minLength": 1,
      "pattern": "^(?:sha256:)?[0-9a-f]{64}$",
      "type": "string"
    },
    "aggregateVersion": {
      "minimum": 0,
      "type": "integer"
    },
    "beforeRoot": {
      "minLength": 1,
      "pattern": "^(?:sha256:)?[0-9a-f]{64}$",
      "type": "string"
    },
    "createdIds": {
      "items": {
        "minLength": 1,
        "pattern": "^[A-Za-z][A-Za-z0-9._:-]{2,127}$",
        "type": "string"
      },
      "minItems": 0,
      "type": "array"
    },
    "diagnostic": {
      "additionalProperties": false,
      "properties": {
        "code": {
          "enum": [
            "PON_AUTHENTICATION_FAILED",
            "PON_AUTHORIZATION_DENIED",
            "PON_CONCURRENCY_CONFLICT",
            "PON_CONTRACT_FIXTURE_UNEXPECTED",
            "PON_CONTRACT_INVALID",
            "PON_CREDENTIAL_INVALID",
            "PON_CUSTODY_NOT_VERIFIED",
            "PON_DATABASE_INVALID",
            "PON_IDEMPOTENCY_CONFLICT",
            "PON_INPUT_INVALID",
            "PON_INTERNAL_ERROR",
            "PON_KERNEL_ALREADY_BOOTSTRAPPED",
            "PON_KERNEL_NOT_BOOTSTRAPPED",
            "PON_LEGACY_SCHEMA_UNSUPPORTED",
            "PON_MIGRATION_MISMATCH",
            "PON_OBSERVATION_MISMATCH",
            "PON_OPERATION_NOT_IMPLEMENTED",
            "PON_OUTPUT_EXISTS",
            "PON_PATH_CONFLICT",
            "PON_PATH_NOT_FOUND",
            "PON_PRODUCTION_MUTATION_FORBIDDEN",
            "PON_RATE_LIMITED",
            "PON_RECONCILIATION_AMBIGUOUS",
            "PON_RECONCILIATION_DUPLICATE",
            "PON_RECONCILIATION_HASH_MISMATCH",
            "PON_RECONCILIATION_ORPHAN",
            "PON_SNAPSHOT_INTEGRITY_FAILURE",
            "PON_SNAPSHOT_SOURCE_CHANGED"
          ],
          "minLength": 1,
          "type": "string"
        },
        "details": {
          "type": "object"
        },
        "message": {
          "minLength": 1,
          "type": "string"
        },
        "retryable": {
          "type": "boolean"
        },
        "schemaVersion": {
          "const": "1"
        },
        "severity": {
          "enum": [
            "INFO",
            "WARNING",
            "ERROR",
            "CRITICAL"
          ],
          "minLength": 1,
          "type": "string"
        }
      },
      "required": [
        "schemaVersion",
        "code",
        "message",
        "severity",
        "retryable",
        "details"
      ],
      "type": "object"
    },
    "eventId": {
      "minLength": 1,
      "pattern": "^[A-Za-z][A-Za-z0-9._:-]{2,127}$",
      "type": "string"
    },
    "ok": {
      "type": "boolean"
    },
    "operation": {
      "const": "task.create"
    },
    "receipt": {
      "additionalProperties": false,
      "properties": {
        "mutationEventId": {
          "minLength": 1,
          "pattern": "^[A-Za-z][A-Za-z0-9._:-]{2,127}$",
          "type": "string"
        },
        "receiptId": {
          "minLength": 1,
          "pattern": "^[A-Za-z][A-Za-z0-9._:-]{2,127}$",
          "type": "string"
        },
        "recordedAt": {
          "minLength": 1,
          "pattern": "^\\d{4}-\\d{2}-\\d{2}T\\d{2}:\\d{2}:\\d{2}(?:\\.\\d+)?Z$",
          "type": "string"
        },
        "requestSha256": {
          "minLength": 1,
          "pattern": "^(?:sha256:)?[0-9a-f]{64}$",
          "type": "string"
        },
        "stateRoot": {
          "minLength": 1,
          "pattern": "^(?:sha256:)?[0-9a-f]{64}$",
          "type": "string"
        }
      },
      "required": [
        "receiptId",
        "requestSha256",
        "recordedAt",
        "stateRoot",
        "mutationEventId"
      ],
      "type": "object"
    },
    "requestId": {
      "minLength": 1,
      "pattern": "^[A-Za-z][A-Za-z0-9._:-]{2,127}$",
      "type": "string"
    },
    "schemaVersion": {
      "const": "1"
    },
    "task": {
      "additionalProperties": false,
      "properties": {
        "acceptanceContractRoot": {
          "minLength": 1,
          "pattern": "^(?:sha256:)?[0-9a-f]{64}$",
          "type": "string"
        },
        "authorityGrantId": {
          "minLength": 1,
          "pattern": "^[A-Za-z][A-Za-z0-9._:-]{2,127}$",
          "type": "string"
        },
        "endpointBinding": {
          "type": [
            "object",
            "null"
          ]
        },
        "id": {
          "minLength": 1,
          "pattern": "^[A-Za-z][A-Za-z0-9._:-]{2,127}$",
          "type": "string"
        },
        "mutablePackageId": {
          "type": [
            "string",
            "null"
          ]
        },
        "objective": {
          "minLength": 1,
          "type": "string"
        },
        "projectId": {
          "minLength": 1,
          "pattern": "^[A-Za-z][A-Za-z0-9._:-]{2,127}$",
          "type": "string"
        },
        "state": {
          "enum": [
            "PROPOSED",
            "TRIAGED",
            "AWAITING_AUTHORITY",
            "PROVISIONING",
            "READY",
            "ACTIVE",
            "BLOCKED",
            "RESPONSE_RETURNED",
            "UNDER_REVIEW",
            "ACCEPTED",
            "CORRECTION_REQUIRED",
            "REJECTED",
            "CLOSED",
            "CANCELLED"
          ],
          "minLength": 1,
          "type": "string"
        },
        "taskKind": {
          "minLength": 1,
          "type": "string"
        }
      },
      "required": [
        "id",
        "projectId",
        "taskKind",
        "objective",
        "mutablePackageId",
        "acceptanceContractRoot",
        "authorityGrantId",
        "state",
        "endpointBinding"
      ],
      "type": "object"
    },
    "warnings": {
      "items": {
        "additionalProperties": false,
        "properties": {
          "code": {
            "enum": [
              "PON_AUTHENTICATION_FAILED",
              "PON_AUTHORIZATION_DENIED",
              "PON_CONCURRENCY_CONFLICT",
              "PON_CONTRACT_FIXTURE_UNEXPECTED",
              "PON_CONTRACT_INVALID",
              "PON_CREDENTIAL_INVALID",
              "PON_CUSTODY_NOT_VERIFIED",
              "PON_DATABASE_INVALID",
              "PON_IDEMPOTENCY_CONFLICT",
              "PON_INPUT_INVALID",
              "PON_INTERNAL_ERROR",
              "PON_KERNEL_ALREADY_BOOTSTRAPPED",
              "PON_KERNEL_NOT_BOOTSTRAPPED",
              "PON_LEGACY_SCHEMA_UNSUPPORTED",
              "PON_MIGRATION_MISMATCH",
              "PON_OBSERVATION_MISMATCH",
              "PON_OPERATION_NOT_IMPLEMENTED",
              "PON_OUTPUT_EXISTS",
              "PON_PATH_CONFLICT",
              "PON_PATH_NOT_FOUND",
              "PON_PRODUCTION_MUTATION_FORBIDDEN",
              "PON_RATE_LIMITED",
              "PON_RECONCILIATION_AMBIGUOUS",
              "PON_RECONCILIATION_DUPLICATE",
              "PON_RECONCILIATION_HASH_MISMATCH",
              "PON_RECONCILIATION_ORPHAN",
              "PON_SNAPSHOT_INTEGRITY_FAILURE",
              "PON_SNAPSHOT_SOURCE_CHANGED"
            ],
            "minLength": 1,
            "type": "string"
          },
          "details": {
            "type": "object"
          },
          "message": {
            "minLength": 1,
            "type": "string"
          },
          "retryable": {
            "type": "boolean"
          },
          "schemaVersion": {
            "const": "1"
          },
          "severity": {
            "enum": [
              "INFO",
              "WARNING",
              "ERROR",
              "CRITICAL"
            ],
            "minLength": 1,
            "type": "string"
          }
        },
        "required": [
          "schemaVersion",
          "code",
          "message",
          "severity",
          "retryable",
          "details"
        ],
        "type": "object"
      },
      "minItems": 0,
      "type": "array"
    }
  },
  "required": [
    "schemaVersion",
    "requestId",
    "operation",
    "ok"
  ],
  "title": "task.create result",
  "type": "object",
  "x-contractStatus": "IMPLEMENTED_P3_3",
  "x-invariants": [
    "For mutating success, receipt.mutationEventId equals eventId"
  ],
  "x-mutates": true
}
