{
  "afterRoot": "sha256:1111111111111111111111111111111111111111111111111111111111111111",
  "aggregateVersion": 0,
  "beforeRoot": "sha256:1111111111111111111111111111111111111111111111111111111111111111",
  "createdIds": [],
  "eventId": "PON-EVENT-001",
  "ok": true,
  "operation": "task.create",
  "receipt": {
    "mutationEventId": "PON-EVENT-001",
    "receiptId": "PON-RECEIPT-001",
    "recordedAt": "2026-09-04T12:00:00Z",
    "requestSha256": "sha256:2222222222222222222222222222222222222222222222222222222222222222",
    "stateRoot": "sha256:1111111111111111111111111111111111111111111111111111111111111111"
  },
  "requestId": "PON-REQUEST-001",
  "schemaVersion": "1",
  "task": {
    "acceptanceContractRoot": "sha256:5555555555555555555555555555555555555555555555555555555555555555",
    "authorityGrantId": "PON-GRANT-001",
    "endpointBinding": null,
    "id": "PON-TASK-001",
    "mutablePackageId": null,
    "objective": "Example objective",
    "projectId": "PON-PROJECT-001",
    "state": "ACTIVE",
    "taskKind": "PROJECT_MANAGEMENT"
  },
  "warnings": []
}
